"Source Url","Headline"
"http://www.publico.es/sociedad/m-ambiente","Greenpeace urge a las marcas a revelar sus proveedores de aceite de palma"
"http://www.publico.es/sociedad/m-ambiente","Unas 3.000 personas se manifiestan en Madrid en defensa del lobo ibérico"
"http://www.publico.es/sociedad/m-ambiente","Más de 330 lobos murieron en 2017 a manos de furtivos, atropellados o envenenados"
"http://www.publico.es/sociedad/m-ambiente","El cambio climático podría acabar en 2080 con la mitad de las especies de las zonas con más fauna del planeta"
"http://www.publico.es/sociedad/m-ambiente","Más del 60% de las alertas por mercurio en la UE vienen del pescado español"
"http://www.publico.es/sociedad/m-ambiente","Organizaciones ecologistas responsabilizan a ACS del daño ambiental y social provocado en una región de Guatemala"
"http://www.publico.es/sociedad/m-ambiente","Una transición a la energía renovable saldría más barata que la indemnización por Castor"
"http://www.publico.es/sociedad/m-ambiente","Las lluvias elevan el nivel de los embalses por encima del 50% por primera vez en 8 meses"
"http://www.publico.es/sociedad/m-ambiente","50 ONG denuncian que el segundo mayor bosque tropical del mundo está en peligro"
"http://www.publico.es/sociedad/m-ambiente","8-M: la hora de las decisiones y otras noticias del informativo 'Público al Día' del 7 de marzo"
"http://www.publico.es/sociedad/m-ambiente","Nueve detenidos y 600 animales exóticos incautados en una operación contra el tráfico de especies en Madrid y Castellón"
"http://www.publico.es/sociedad/m-ambiente","Investigado en Valladolid por envenenar y matar a animales salvajes protegidos"
"http://www.publico.es/sociedad/m-ambiente","El negocio del campo se dispara mientras 7.000 agricultores dejan la tierra cada año"
"http://www.publico.es/sociedad/m-ambiente","Cuatro claves para entender la trampa en la sequía del Levante"
"http://www.publico.es/sociedad/m-ambiente","50.000 personas protestan en Madrid para pedir soluciones a la sequía en el Levante"
"http://www.publico.es/sociedad/m-ambiente","La Fiscalía investigará una posible trama en los incendios de cientos de vertederos"
"http://www.publico.es/sociedad/m-ambiente","Impuestos al diésel: lo que el Gobierno no hace por la contaminación de las ciudades"
"http://www.publico.es/sociedad/m-ambiente","Toyota suprimirá los motores diésel en todos sus turismos en Europa desde este año"
"http://www.publico.es/sociedad/m-ambiente","Un pesquero con 1.500 litros de gasoil se hunde frente a Muxía (A Coruña)"
"http://www.publico.es/sociedad/m-ambiente","Conversaciones en Catalunya y otras noticias del informativo 'Público al Día' del 5 de marzo de 2018"
